pubmed_id,title,authors,journal,pub_date,keywords_found
41793357,One-Step Multi-fragment Assembly and Targeted Genomic Integration in Corynebacterium glutamicum.,"Wang X, Yang S, Zhou X, Zhu J, Qian F, Jiang Y, Yang S",ACS synthetic biology,2026 Mar 7,assembly
41792214,"High quality chromosome-level genome assembly of Psammosilene tunicoides (Caryophyllaceae), an endangered medicinal plant.","Xie Z, Zhang Y, Yang C, Zhang T, Zhang A, Li G",Scientific data,2026 Mar 6,"genome, assembly, chromosome"
41792149,Chromosome-level genome assembly of Neoseiulus longispinosus (Phytoseiidae).,"Han ZR, Zheng LJ, Liang L, Ye ZP, Fu YG, Yi TC, Chen JY",Scientific data,2026 Mar 6,"genome, assembly, chromosome"
41784355,Unraveling the genome of Epidendrum fulgens: demographic history and gene family dynamics in a resilient Neotropical orchid.,"de Mattos JS, Aecyo P, Keepers K, Tavares MM, Della-Rosa F, Palma-Silva C, Kane NC, Pinheiro F, Riaño-Pachon DM",Genome biology and evolution,2026 Mar 5,genome
41782323,"First genome and transcription factor profile for Asimina triloba, a native North American fruit tree.","Yulfo-Soto GE, Toth H, Francino SE, Leung J, Meinhardt LW, Davies GM, Jacobs JM, Cohen SP",The plant genome,2026 Mar,genome
